{"schemaVersion":2,"id":"france-england-peasant-revolts","name":"Франция мен Англиядағы шаруалар көтерілісі","period":"medieval","periodLabel":"Орта ғасыр","status":"ready","facts":[{"id":"pe1","date":"ХІ ғасырдан бері","event":"Батыс Еуропа халқының саны үнемі өсумен болды.","distractorIds":["pe2","pe3","pe4"]},{"id":"pe2","date":"XIV ғасырдан бастап","event":"Еуропада климат нашарлап, ауа райы суытып, қуаңшылық орын алды.","distractorIds":["pe1","pe3","pe5"]},{"id":"pe3","date":"XIV ғасыр","event":"Еуропада «Қара өлім» деп аталатын оба індеті таралып, Франция мен Англияда ірі шаруалар көтерілісіне әкелді.","distractorIds":["pe2","pe4","pe6"]},{"id":"pe4","date":"1347 жылы","event":"Ең қауіпті індет («қара өлім») басталды.","distractorIds":["pe3","pe5","pe6"]},{"id":"pe5","date":"XIV ғасырдың ортасы","event":"Үш жыл ішінде індеттен Еуропа халқының үштен бірі қаза тапты.","distractorIds":["pe3","pe4","pe6"]},{"id":"pe6","date":"1358 жылы (мамыр-қыркүйек)","event":"Францияда Жакерия көтерілісі болды (мамыр айында Париждің солтүстігінде басталды).","distractorIds":["pe7","pe8","pe11"]},{"id":"pe7","date":"1358 жылы (8 маусым)","event":"Жакерия көтерілісшілері Наварра королі Қатыгез Карлдың әскерімен кездесті.","distractorIds":["pe6","pe8","pe9"]},{"id":"pe8","date":"1358 жыл (9 маусым)","event":"Париждегі көтерілістің бір күні (Жак Фруассардың «Хроникасынан»).","distractorIds":["pe6","pe7","pe9"]},{"id":"pe9","date":"1358 жылы","event":"Француз тағының мұрагері Карл Парижды басып алып, көтерілісшілерді жазалады. Көтерілістен кейін билікке келген Карл салық реформасын жүргізді.","distractorIds":["pe6","pe7","pe11"]},{"id":"pe10","date":"XIV ғасырдың 60-70-жылдары","event":"Жүзжылдық соғысқа байланысты Англияның экономикалық жағдайы нашарлады.","distractorIds":["pe5","pe9","pe11"]},{"id":"pe11","date":"1381 жылы (мамыр - қараша)","event":"Англияда Уот Тайлер көтерілісі өтті.","distractorIds":["pe6","pe12","pe13"]},{"id":"pe12","date":"1381 жылдың көктемі (мамырдың соңы)","event":"Англияның оңтүстік-шығысында (Эссекс графтығында) шаруалар көтерілісі басталды.","distractorIds":["pe10","pe11","pe13"]},{"id":"pe13","date":"1381 жылы 13 маусым","event":"II Ричардтың көтерілісшілермен кездесyi.","distractorIds":["pe9","pe11","pe12"]}],"people":[{"id":"guillaume-cale","name":"Гильом (Гийом) Каль","clues":["Жакерия көтерілісіне жетекшілік еткен, әскери істі білетін шаруа. Қатыгез Карлдың сөзіне сеніп келіссөзге келіп, қолға түсті және феодалдар оны алдап өтірді."]},{"id":"charles-bad","name":"Қатыгез Карл","clues":["Наварра королі. Көтерілісшілердің саны басым болғандықтан, Гильом Кальды келісімге келуге шақырды."]},{"id":"charles-v","name":"Карл (Француз тағының мұрагері / V Карл)","clues":["1358 жылы Парижды басып алып, көтерілісшілерді жазалады. Билікке келген соң салық реформасын жүргізіп, салық жинаушыларға бақылау орнатты."]},{"id":"wat-tyler","name":"Уот Тайлер","clues":["Бұрын Жүзжылдық соғысқа қатысқан, Англиядағы шаруалар көтерілісінің басшысы. Келіссөз кезінде Лондонның мәрі оны опасыздықпен өтірді."]},{"id":"john-ball","name":"Джон Болл","clues":["Үкімет қарсы үгіттеуі үшін түрмеге қамаған, кейін көтерілісшілер босатып алған уағыздаушы. Уот Тайлермен бірге Лондонға қалып, корольге екінші рет жаңа талаптар қойды."]},{"id":"richard-ii","name":"ІІ Ричард","clues":["Англия королі. Көтерілісшілермен кездесіп, олардың талаптарын орындайтынына уәде беріп, шаруаларды үйлеріне қайтуға көндірді."]}],"chronologySets":[["pe4","pe6","pe11","pe13"],["pe4","pe7","pe10","pe11"],["pe6","pe7","pe8","pe9"],["pe10","pe12","pe13","pe11"]]}