{"schemaVersion":2,"id":"post-crusades-world","name":"КРЕСТ ЖОРЫҚТАРЫНАН КЕЙІНГІ ӘЛЕМ","period":"medieval","periodLabel":"Орта ғасыр","status":"ready","facts":[{"id":"pcw1","date":"1031 жыл","event":"Кордова халифаты әмірліктерге ыдырады.","distractorIds":["pcw2","pcw4","pcw11"]},{"id":"pcw2","date":"1237 жыл","event":"Тевтон ордені Семсерлілер орденімен бірікті.","distractorIds":["pcw1","pcw9","pcw10"]},{"id":"pcw3","date":"1250-1517 жылдар","event":"Таяу Шығыста мәмлүктер билік құрған жылдар.","distractorIds":["pcw5","pcw7","pcw12"]},{"id":"pcw4","date":"1258 жыл","event":"Монғол шапқыншылығы салдарынан Аббасидтер халифаты құлады.","distractorIds":["pcw1","pcw3","pcw6"]},{"id":"pcw5","date":"1260-1277 жылдар","event":"Египетте мәмлүк сұлтаны Бейбарыстың билік еткен жылдары (17 жыл бойы басқарды).","distractorIds":["pcw3","pcw6","pcw7"]},{"id":"pcw6","date":"1261 жыл","event":"Крестшілер құрған Латын империясы құлатылып, Византия қайта калпына келтірілді.","distractorIds":["pcw4","pcw5","pcw7"]},{"id":"pcw7","date":"1291 жыл","event":"Крестшілердің соңғы тірегі - Акка (Акра) құлады. Еуропалықтардың Шығыс елдерінде тұрақтау мүмкіндігі жойылды.","distractorIds":["pcw5","pcw6","pcw11"]},{"id":"pcw8","date":"1386 жыл","event":"Поляктар мен литвалықтар одақ құрды.","distractorIds":["pcw9","pcw10","pcw2"]},{"id":"pcw9","date":"1410 жыл","event":"Грюнвальд түбіндегі шайқаста Польша-Литва одағы Тевтон орденін күйрете жеңді.","distractorIds":["pcw8","pcw10","pcw2"]},{"id":"pcw10","date":"1466 жыл","event":"Тевтон ордені Польшаға тәуелділігін мойындады.","distractorIds":["pcw8","pcw9","pcw11"]},{"id":"pcw11","date":"1492 жыл","event":"Пиреней түбегіндегі соңғы мұсылман мемлекеті Гранада әмірлігі жойылды.","distractorIds":["pcw1","pcw7","pcw12"]},{"id":"pcw12","date":"XV ғ. ортасы","event":"Осман түріктері Византияны құлатып, Кіші Азияда қуатты мұсылман мемлекетін құрды.","distractorIds":["pcw6","pcw10","pcw11"]}],"people":[{"id":"richard-i","name":"І Ричард (Арыстан жүректі)","clues":["Англия королі. Крест жорықтарында көп қаржы жұмсап, Англиядағы король билігін әлсіретті."]},{"id":"frederick-barbarossa","name":"Фридрих І Барбаросса","clues":["Германия императоры (Штауфендер әулетінен). Үшінші крест жорығына қатысып, Сирия жерінде суға кетіп қайтыс болды."]},{"id":"innocent-iii","name":"III Иннокентий","clues":["Рим папасы. Католик шіркеуін күшейтіп, неміс рыцарьларының орыс жерлері мен Балтық бойын жаулап алу науқанын ұйымдастырды."]},{"id":"saladin","name":"Салах ад-Дин","clues":["Аюбилер әулетінің негізін қалаған атақты мұсылман қолбасшысы."]},{"id":"baybars","name":"Сұлтан Бейбарыс","years":"1260-1277 жж.","clues":["Мәмлүк сұлтаны. Қазақ даласынан шыққан жауынгер. Египетті крестшілерден де, монғолдардан да қорғап қалды, 17 жыл бойы мұсылман елдерін басқарды."]},{"id":"usama-munqidh","name":"Усама Мункыз","clues":["Араб жазушысы, «Өсиет кітабы» (Китаб ал-Итибар) авторы. Франктердің (крестшілердің) мінезі мен жауынгерлігін суреттеген."]}],"chronologySets":[["pcw1","pcw2","pcw4","pcw6"],["pcw3","pcw4","pcw5","pcw7"],["pcw2","pcw8","pcw9","pcw10"],["pcw6","pcw7","pcw11","pcw12"],["pcw4","pcw7","pcw9","pcw11"],["pcw1","pcw6","pcw8","pcw11"]]}