{"schemaVersion":2,"id":"alexander-macedonian-empire","name":"Александр Македонскийдің империясы","period":"ancient","periodLabel":"Ежелгі заман","status":"ready","facts":[{"id":"am1","date":"Б.з.б. 359 жылы","event":"ІІ Филипп Македонияның жоғарғы билеушісі болып тағайындалды. Ол ақсүйектердің ықпалын азайтып, әскерді қайта жасақтады.","distractorIds":["am2","am3","am4"]},{"id":"am2","date":"Б.з.б. 338 жылы","event":"Херонея қаласының маңында македондықтар мен гректер арасында шайқас болып, гректер жеңіліске ұшырады.","distractorIds":["am1","am3","am4"]},{"id":"am3","date":"Б.з.б. 337 жылы","event":"Грек қалаларының өкілдері Коринф конгресінде II Филипптің басшылығымен эллиндік одақ құрды. Мақсаты — Парсы патшалығын жаулап алу.","distractorIds":["am2","am4","am5"]},{"id":"am4","date":"Б.з.б. 336 жылы","event":"ІІ Филипп қаза тауып, таққа оның баласы Александр отырды. Ол Грекияға Македонияның бақылауын орнатты.","distractorIds":["am3","am5","am6"]},{"id":"am5","date":"Б.з.б. 334 жылдың көктемі","event":"Александр Шығысқа жорығын бастады. Ол 20 күнде Геллеспонтқа жетіп, 160 кемемен кесіп өтті.","distractorIds":["am4","am6","am7"]},{"id":"am6","date":"Б.з.б. 334 жылы (мамыр-маусым)","event":"Граник өзенінің жағалауында парсылармен алғашқы ірі шайқас өтіп, Александр жеңіске жетті.","distractorIds":["am5","am7","am8"]},{"id":"am7","date":"Б.з.б. 333 жылы (қараша)","event":"Иссе маңындағы шайқаста Александр парсы патшасы III Дарийдің әскерін талқандады. III Дарий қашып кетті. Одан кейін Сирияны жаулап алды.","distractorIds":["am6","am8","am9"]},{"id":"am8","date":"Б.з.б. 332 жылдың тамызы","event":"Тир қаласы құлады. Финикия қалалары Александрдың билігін мойындады. Ол Египетті соғыссыз бағындырды.","distractorIds":["am7","am9","am10"]},{"id":"am9","date":"Б.з.б. 331 жылдың 1 қазаны","event":"Гавгамел маңында алапат шайқас өтті. Парсы әскері толық қирап, III Дарий Мидияға қашты. Бұл парсылардың жеңілгендігінің белгісі болды.","distractorIds":["am8","am10","am11"]},{"id":"am10","date":"Б.з.б. 328 жылы","event":"Орталық Азияда Александрға қарсы көтеріліс жасаған ақсүйек Спитамен қаза тапты. Александр жергілікті халықтың әдет-ғұрпына құрмет көрсете бастады.","distractorIds":["am9","am11","am12"]},{"id":"am11","date":"327 жылы","event":"Орта Азияны бағындырған соң грек-македон әскерлері Гиндукуш арқылы Солтүстік Үндістанға, Үнді өзенінің аңғарына қарай жылжыды.","distractorIds":["am10","am12","am13"]},{"id":"am12","date":"Б.з.б. 324 жылы","event":"Александр әскері шөл арқылы үлкен қиындықпен өтіп, Вавилонға келіп жетті.","distractorIds":["am9","am11","am13"]},{"id":"am13","date":"Б.з.б. 323 жылы","event":"Вавилонда жаңа жорыққа дайындалып жатқан кезде Александр безгек ауруына шалдығып, дүниеден өтті.","distractorIds":["am10","am11","am12"]}],"people":[{"id":"philip-ii","name":"II Филипп","clues":["Македонияның жоғарғы билеушісі болды. Ақсүйектердің саяси ықпалын азайтып, әскерді қайта жасақтады. Херонеяда гректерді жеңіп, Эллиндік одақ құрды. Б.з.б. 336 жылы қаза тапты."]},{"id":"alexander","name":"Александр Македонский","clues":["Македония билеушісі, Эллиндік одақтың жетекшісі әрі Парсыға жорықтың бас қолбасшысы. Граник, Исс және Гавгамелде жеңіске жетті. Египет, Орта Азия және Үндістанға жорық жасады. Вавилонды империя астанасы деп жариялады."]},{"id":"darius-iii","name":"III Дарий","clues":["Парсы патшасы. Исс шайқасынан кейін қашты, бейбітшілік ұсынды. Гавгамелде әскері жеңіліп, Мидияға қашты. Кейін бағынышты ақсүйектері өлтірді."]},{"id":"parmenion","name":"Парменион","clues":["Александр Македонскийдің әскери қолбасшысы. Гавгамел шайқасында сол қанаттағы фессалиндік жауынгерлерді басқарды."]},{"id":"spitamen","name":"Спитамен","clues":["Согды руынан шыққан ақсүйек. Орта Азияда Александрдың қатаң саясатына қарсы көтеріліс бастады. Б.з.б. 328 жылы қаза тапты."]},{"id":"aristotle","name":"Аристотель","clues":["Александрдың ұстазы."]}],"chronologySets":[["am1","am2","am3","am4"],["am4","am5","am6","am7"],["am6","am7","am8","am9"],["am9","am10","am11","am12"],["am10","am11","am12","am13"]]}