{"schemaVersion":2,"id":"yuan-empire","name":"Юань империясы","period":"medieval","periodLabel":"Орта ғасыр","status":"ready","facts":[{"id":"yuan1","date":"1211-1279 жылдар","event":"Қытайды бағындыру жолындағы монғолдардың соғыстары жүргізілді.","distractorIds":["yuan2","yuan5","yuan6"]},{"id":"yuan2","date":"1260 жыл","event":"Шыңғыс ханның немересі Құбылай Ұлы хан тағына отырды.","distractorIds":["yuan3","yuan4","yuan5"]},{"id":"yuan3","date":"1260-1294 жылдар","event":"Құбылай ханның билік жүргізген жылдары.","distractorIds":["yuan2","yuan4","yuan5"]},{"id":"yuan4","date":"1264 жыл","event":"Құбылай астананы Дадуға (Пекин) көшірді.","distractorIds":["yuan2","yuan5","yuan6"]},{"id":"yuan5","date":"1271 жыл","event":"Құбылай қытайша Дай Юань деген атақ алып, Юань әулетінің негізін қалады. «Ауылшаруашылық қауымы туралы» Ереже шықты.","distractorIds":["yuan4","yuan6","yuan7"]},{"id":"yuan6","date":"1279 жыл","event":"Монғолдардың Қытайды бағындыру соғыстары аяқталды.","distractorIds":["yuan5","yuan7","yuan8"]},{"id":"yuan7","date":"1280 жыл","event":"Құбылай Қытайда 1368 жылға дейін өмір сүрген императорлық Юань династиясын құрды.","distractorIds":["yuan5","yuan6","yuan8"]},{"id":"yuan8","date":"1296 жыл","event":"XIII ғасырдың 60-жылдарымен салыстырғанда айналымдағы қағаз ақша он екі есе көбейді.","distractorIds":["yuan9","yuan16","yuan18"]},{"id":"yuan9","date":"1312 жыл","event":"Айналымдағы қағаз ақша жиырма бес есе көбейді.","distractorIds":["yuan8","yuan10","yuan16"]},{"id":"yuan10","date":"1327 жыл","event":"Монғол билеушілері ғибадатханаларға халықтан жер сатып алуға тыйым салды.","distractorIds":["yuan9","yuan11","yuan12"]},{"id":"yuan11","date":"1350-1351 жылдары","event":"Хуанхэ өзеніндегі тасқын әсерінен халықтың жаппай наразылығы басталды.","distractorIds":["yuan12","yuan13","yuan19"]},{"id":"yuan12","date":"1351 жыл","event":"Тогон-Темір халыққа қорғаныс бөгеттерін салуды бұйырды.","distractorIds":["yuan11","yuan13","yuan14"]},{"id":"yuan13","date":"1356 жылы","event":"Қызыл әскерлер Монғол династиясының астанасы Даду (Пекин) қаласына қауіп төндірді.","distractorIds":["yuan11","yuan12","yuan14"]},{"id":"yuan14","date":"1368 жылы","event":"Шаруалар көтерілісінің нәтижесінде Юань империясы/династиясы құлады. Чжу Юань-чжан «Мин» деп аталған жаңа династияның негізін қалады.","distractorIds":["yuan12","yuan13","yuan20"]},{"id":"yuan15","date":"ХІІІ ғасыр","event":"Марко Полоның жазбаларында Ханчжоу қаласында 15 сауда бірлестігі болғаны айтылады. Салық мөлшері 20 есеге өсті.","distractorIds":["yuan16","yuan17","yuan18"]},{"id":"yuan16","date":"XIII ғасырдың 60-жылдары","event":"Қағаз ақша көлемін салыстырудың бастапқы кезеңі.","distractorIds":["yuan8","yuan9","yuan15"]},{"id":"yuan17","date":"XIII-XIV ғасырлар","event":"Қытай Монғол династиясының билігінде болды.","distractorIds":["yuan15","yuan18","yuan19"]},{"id":"yuan18","date":"XIV ғасырдың басы","event":"Билік үшін таққа таласқандар арасында үзіліссіз соғыс жүріп отырды.","distractorIds":["yuan17","yuan19","yuan20"]},{"id":"yuan19","date":"XIV ғасырдың ортасы","event":"Қытай халықының монғол хандарына қарсы ашық күресі шегіне жетті.","distractorIds":["yuan11","yuan18","yuan20"]},{"id":"yuan20","date":"XIV ғасырдың 60-жылдары","event":"Монғолдарға қарсы көтеріліс Қытайдың көптеген провинцияларында жалғасты.","distractorIds":["yuan13","yuan14","yuan19"]}],"people":[{"id":"kublai","name":"Құбылай хан","years":"1260-1294 жж.","clues":["Шыңғыс ханның немересі. 1260 жылы Ұлы хан тағына отырды. 1264 жылы астананы Дадуға (Пекин) көшірді. 1271 жылы «Дай Юань» атағын алып, Юань әулетін құрды. Басқаруда қытай үлгісін басшылыққа алды. Ауылшаруашылығын дамыту шараларын жүргізді, «Ауылшаруашылық бас басқармасын» құрды. Будда дінін, ғалымдарды қолдады."]},{"id":"marco-polo","name":"Марко Поло","clues":["ХІІІ ғасырдағы венециялық саяхатшы. Юань империясында 17 жыл шенеунік болып қызмет еткен. Ханчжоуда 15 сауда-қолөнер бірлестігі болғанын жазған. Құбылай ханды өте дана, ақылды билеуші деп көрсеткен."]},{"id":"toghon-temur","name":"Тогон-Темір (Шуньди)","clues":["Қытайдағы монғол династиясының соңғы императоры. 1351 жылы халыққа қорғаныс бөгеттерін салуды бұйырды."]},{"id":"han-shantong","name":"Хань Шань-тун","clues":["«Ақ лотос» қоғамының мүшесі, монғолдарға қарсы көтерілісті бастаған тұлға."]},{"id":"han-liner","name":"Хань Линь-эр","clues":["Хань Шань-тунның ұлы, әкесі қаза тапқан соң оның орнын басқан «Ақ лотос» ұйымының мүшесі."]},{"id":"zhu-yuanzhang","name":"Чжу Юань-чжан","clues":["Шаруалардан жасақталған әскердің қолбасшысы. 1368 жылы император болып жарияланып, монғолдардың Юань династиясын құлатты және жаңа «Мин» династиясының негізін қалады."]}],"chronologySets":[["yuan2","yuan4","yuan5","yuan6"],["yuan4","yuan5","yuan6","yuan7"],["yuan5","yuan6","yuan8","yuan9"],["yuan8","yuan9","yuan10","yuan12"],["yuan10","yuan11","yuan12","yuan13"],["yuan11","yuan12","yuan13","yuan14"],["yuan2","yuan5","yuan12","yuan14"],["yuan4","yuan6","yuan10","yuan14"]]}