{
  "schemaVersion": 2,
  "id": "africa-traditional-civilization",
  "name": "Африка дәстүрлі өркениеті",
  "period": "medieval",
  "periodLabel": "Орта ғасыр",
  "status": "ready",
  "facts": [
    {"id":"af1","date":"б.з. 1-мыңжылдығы","event":"Батыс Африкада алғашқы қауымдық құрылыстан өтіп, аймақтағы көптеген халықтарда жоғарғы деңгейдегі қоғамдық құрылыс формасы қалыптасты.","distractorIds":["af2","af3","af4"]},
    {"id":"af2","date":"VI ғасыр","event":"Христиандық қабылданғаннан кейін Нубия шіркеуі Египеттің мәдени және діни ықпалына түсе бастады.","distractorIds":["af1","af3","af4"]},
    {"id":"af3","date":"VII-XIV ғасырлар","event":"Бұл кезеңде Нубияда бірнеше нубилік христиан мемлекеттері болды.","distractorIds":["af2","af4","af5"]},
    {"id":"af4","date":"VIII ғасыр","event":"Араб деректерінде Гана «Алтын мемлекеті» деген атпен кездеседі.","distractorIds":["af3","af5","af6"]},
    {"id":"af5","date":"ІХ ғасыр","event":"Гана өзінің солтүстік шегарасында көшіп-қонып жүрген бербер тайпаларымен соғысуға мәжбүр болды.","distractorIds":["af4","af6","af7"]},
    {"id":"af6","date":"ІХ-Х ғасырлар","event":"Гана қарқынды дами түсіп, алғашқы таптық қоғамда мемлекеттіліктің дамуы айтарлықтай алға жылжыды.","distractorIds":["af5","af7","af8"]},
    {"id":"af7","date":"Х ғасырдан бастап","event":"Елдің солтүстігіндегі құнарлы жерлерді египеттік арабтардың сатып ала бастауы аясында Нубияға исламның қанат жаюы басталды.","distractorIds":["af6","af8","af9"]},
    {"id":"af8","date":"ХІ ғасыр","event":"Нигер және Бакой өзендерінің аралығында шағын ғана тайпалық Мали князьдігі құрылды.","distractorIds":["af7","af9","af10"]},
    {"id":"af9","date":"1054 жылы","event":"Альморавидтер Аудагост сауда орталығын өз қарамағына алды.","distractorIds":["af8","af10","af11"]},
    {"id":"af10","date":"1076 жылы","event":"Альморавидтер Гана мемлекетінің астанасын басып алды.","distractorIds":["af9","af11","af12"]},
    {"id":"af11","date":"XIII ғасырдың басы","event":"Тәуелсіз сосо тайпасы Гананың астанасын жаулап алды.","distractorIds":["af10","af12","af13"]},
    {"id":"af12","date":"1235 жылы","event":"Крина елді мекені маңында шайқас болды; Сундиат Кейт Сосо көсемін және Гана билеушісін жеңіп, астанасын талқандады.","distractorIds":["af11","af13","af14"]},
    {"id":"af13","date":"1307-1332 жылдар","event":"Манса (патша) Мұса патшалық құрды.","distractorIds":["af12","af14","af15"]},
    {"id":"af14","date":"1323 жылы","event":"Макурияның билеушісі ислам дінін қабылдады.","distractorIds":["af13","af15","af16"]},
    {"id":"af15","date":"XIV ғасыр","event":"Географиялық карталардың деректерінде «Мали королінің» меншігі туралы жиі қайталанады.","distractorIds":["af14","af16","af17"]},
    {"id":"af16","date":"XV ғасырдың басы","event":"Сонгай мемлекеті құрылды.","distractorIds":["af15","af17","af18"]},
    {"id":"af17","date":"XVI ғасырдың басы","event":"Нубия толығымен ислам билеушілерінің бақылауына өтті.","distractorIds":["af16","af18","af19"]},
    {"id":"af18","date":"1464-1492 жылдар","event":"Әли сонни билік жүргізді.","distractorIds":["af17","af19","af20"]},
    {"id":"af19","date":"1468 жылы","event":"Әли сонни Томбуктуды басып алып, туарег пен моси тайпаларының шабуылын қайтарды.","distractorIds":["af18","af20","af21"]},
    {"id":"af20","date":"1493-1528 жылдар","event":"Мұхаммед билік құрды.","distractorIds":["af19","af21","af22"]},
    {"id":"af21","date":"XVI ғасыр","event":"Сонгай мемлекеті дамып, өз шегарасын батысқа қарай Сахара-Анра шегарасына дейін, ал солтүстік-шығыста Борнудың батыс қиырына дейін соза бастады.","distractorIds":["af20","af22","af23"]},
    {"id":"af22","date":"XVI ғасырдың екінші жартысы","event":"Сонгайда өзара қырқыс пен династиялық бөлінулер орын алды.","distractorIds":["af21","af23","af24"]},
    {"id":"af23","date":"XVI ғасырдың соңы","event":"Сонгай мароккалықтардың экспансиясына ұшырай бастады; мароккалықтардың шапқыншылығы кезінде көптеген ғылыми еңбектер мен қолжазбалар жойылып кетті.","distractorIds":["af22","af24","af25"]},
    {"id":"af24","date":"1584 және 1591 жылдары","event":"Мароккалықтар Сонгайдың бірқатар қалаларына шабуыл жасады.","distractorIds":["af23","af25","af22"]},
    {"id":"af25","date":"XVII ғасырдың ортасы","event":"Оңтүстік Африкаға еуропалықтар келе бастады.","distractorIds":["af24","af23","af22"]}
  ],
  "people": [
    {"id":"al-bakri","name":"Әл-Бәкір","clues":["Арабтық автор.","Гана патшалығының астанасын сипаттап жазып қалдырған («Патшаның қаласы әл-Ғаба», тастар мен акация ағашынан жасалған тұрғын үйлер кешені, әйнек тектес қоршау)."]},
    {"id":"sundiat-keita","name":"Сундиат Кейт","clues":["Мали мемлекетінің даңқты билеушісі.","ХІІІ ғасырдың басында Гананы жаулап алып, өзінің империясына бағынышты етті.","1235 жылы Крина маңындағы шайқаста Сосо көсемін және Гана билеушісін жеңіп, жаңа ордасын тікті.","Мемлекеттік ұйымдардың тәртібін, салық жүйесін жетілдірді; ормандар оталып, егістік жерлер ұлғайтылды, мақта өндірісі қолға алынды."]},
    {"id":"mansa-musa","name":"Мұса манса (Манса Мұса)","clues":["1307-1332 жылдар аралығында патшалық құрған Мали билеушісі.","Оның кезінде Мали өте үлкен аумақты қамтып, өзінің мәдени шыңына жетті.","Египет пен Арабия түбегі билеушілерімен бейбіт қатынас ұстанды.","Гао, Томбукту және Дженне қалалары мұсылман ғылымының орталығына айналды."]},
    {"id":"ali-sonni","name":"Әли сонни","clues":["Сонгай мемлекетінің билеушісі (1464-1492).", "«Ұлы» деген атақты иеленген.","1468 жылы Томбуктуды басып алып, туарег пен моси тайпаларының шабуылын қайтарды.","Шаруалардан жасақталған әскер арқылы қуатты империя құрып, Женьді жаулап алу арқылы алтын кен орындарын қаратты."]},
    {"id":"nuh-songhai","name":"Нұх","clues":["Сонгай империясында кейін билік басына келген тұлға.","Ол мароккалық әскерлерді әлсіретіп, кейбір бөлімшелерін жойды."]},
    {"id":"muhammad-songhai","name":"Мұхаммед","clues":["Сонгай билеушісі (1493-1528).","Бірыңғай шаралар мен салық жүйелерін, жаңа ауылшаруашылық дақылдары мен каналдарды енгізді.","Тұрақты әскер мен Нигерде сонгай флотын құрды.","Ғылым мен ислам заң шығару жүйесін қолдады."]}
  ],
  "chronologySets": [
    ["af2","af4","af5","af9"],
    ["af4","af9","af10","af12"],
    ["af9","af10","af12","af14"],
    ["af10","af12","af13","af14"],
    ["af12","af13","af14","af19"],
    ["af13","af14","af19","af20"],
    ["af14","af18","af19","af20"],
    ["af18","af19","af20","af24"],
    ["af19","af20","af24","af25"],
    ["af9","af12","af19","af24"]
  ]
}