{"schemaVersion":2,"id":"europe-centralized-states","name":"Еуропадағы орталықтанған мемлекеттердің қалыптасуы","period":"medieval","periodLabel":"Орта ғасыр","status":"ready","facts":[{"id":"cs1","date":"VIII ғасыр","event":"Пиреней түбегіне арабтар үстемдігі орнады.","distractorIds":["cs2","cs5","cs10"]},{"id":"cs2","date":"ХІ ғасыр","event":"Англияны Нормандия герцогі Вильгельм басқарған француз-норман феодалдарының жаулап алуы болды.","distractorIds":["cs3","cs6","cs11"]},{"id":"cs3","date":"ХІ ғасырдың ІІ жартысы","event":"Қалалар мен тауар-ақша қатынасының дамуына байланысты Батыс Еуропа елдерінде саяси бірігу басталып, король өкіметі күшейді.","distractorIds":["cs4","cs7","cs12"]},{"id":"cs4","date":"1066 жылы","event":"1. Вильгельм Ла-Манш арқылы Англияға басып кірді.\n2. Гастингс шайқасында Гарольд өлтірілді.\n3. Вильгельм өзін Англия королі деп жариялады.","distractorIds":["cs5","cs8","cs13"]},{"id":"cs5","date":"1086 жылы","event":"Вильгельм жер, халық және мүлік санағын жүргізді («Қаһарлы сот кітабы»).","distractorIds":["cs6","cs9","cs14"]},{"id":"cs6","date":"ХІІ ғасырдың ІІ жартысы","event":"Францияда король билігі күшейіп, жергілікті феодалдарға қарсы күресте қалалықтарды қолдады.","distractorIds":["cs7","cs10","cs15"]},{"id":"cs7","date":"1137 жылы","event":"Кастилия аймағында Кортес пайда болды.","distractorIds":["cs8","cs11","cs16"]},{"id":"cs8","date":"1154-1189 жылдары","event":"ІІ Генрих Плантагенеттің тұсында Англия одан сайын қанат жайып, Франция жерінің 2/3 бөлігін иемденді.","distractorIds":["cs9","cs12","cs17"]},{"id":"cs9","date":"1188 жылы","event":"Қала тұрғындарының өкілдерінен Кортес өкілетті органы құрылды.","distractorIds":["cs10","cs13","cs18"]},{"id":"cs10","date":"1215 жылы","event":"1. Англияда корольге қарсы көтеріліс болды.\n2. Король «Еркіндіктің ұлы хартиясы» құжатына қол қоюға мәжбүр болды.","distractorIds":["cs11","cs14","cs19"]},{"id":"cs11","date":"1216-1272 жылдары","event":"Англияда III Генрих билік құрды.","distractorIds":["cs12","cs15","cs20"]},{"id":"cs12","date":"1259 жылы","event":"Англия мен Франция арасында бітімшарт жасалып, Англия Францияның солтүстігі мен Нормандиядан бас тартты.","distractorIds":["cs13","cs16","cs21"]},{"id":"cs13","date":"1263 жылы","event":"1. Англияда король мен барондар арасында соғыс басталды.\n2. Барондар жеңіске жетті.","distractorIds":["cs14","cs17","cs22"]},{"id":"cs14","date":"1265 жылы","event":"Барондар халық өкілдерінің жиналысын шақырды (Ағылшын парламентінің бастамасы).","distractorIds":["cs15","cs18","cs23"]},{"id":"cs15","date":"1285-1314 жылдары","event":"IV Көркем Филипп король билік құрды.","distractorIds":["cs16","cs19","cs24"]},{"id":"cs16","date":"1302 жылы","event":"Францияда жаңа жүйе — Бас штаттар құрылды.","distractorIds":["cs17","cs20","cs25"]},{"id":"cs17","date":"1479 жылы","event":"1. Арагон королі Фердинанд Кастилия патшайымы Изабеллаға үйленді.\n2. Испан корольдігі пайда болды.","distractorIds":["cs18","cs21","cs26"]},{"id":"cs18","date":"1492 жылы","event":"Фердинанд пен Изабелланың біріккен әскері Гранаданы қосып алды.","distractorIds":["cs19","cs22","cs27"]},{"id":"cs19","date":"1512 жылы","event":"Испанияға Наварра қосылды.","distractorIds":["cs20","cs23","cs1"]},{"id":"cs20","date":"1516 жылы","event":"Арагондық Фердинанд қайтыс болды.","distractorIds":["cs21","cs24","cs2"]},{"id":"cs21","date":"1516-1556 жылдары","event":"V Карл Испания тағына отырды.","distractorIds":["cs22","cs25","cs3"]},{"id":"cs22","date":"1588 жылы","event":"1. Испан королі «Жеңілмейтін армада» флотын Англияға аттандырды.\n2. Испан флоты тас-талқан болып жеңілді.","distractorIds":["cs23","cs26","cs4"]},{"id":"cs23","date":"1618-1648 жылдары","event":"Испания Франция, Голландия және Швецияға қарсы соғыстарда жеңіліп қалды.","distractorIds":["cs24","cs27","cs5"]},{"id":"cs24","date":"XIV-XV ғасырлар","event":"Еуропада ұлттық мемлекеттер құрыла бастады (Франция, Англия, Испания).","distractorIds":["cs25","cs1","cs6"]},{"id":"cs25","date":"XIV ғасыр","event":"1. Англияда Робин Гуд туралы балладалар айтылды.\n2. Польшада Сейм пайда болды.\n3. Испанияда Кортестер феодалдар билігін шектеді.","distractorIds":["cs26","cs2","cs7"]},{"id":"cs26","date":"XVI ғасыр","event":"1. Испанияда инквизиция құрылды.\n2. XVI ғасырдың аяғында Испания теңіздегі үстемдігінен айырылды.\n3. XVI ғасырдың ортасында Испания саяси-экономикалық дағдарысқа ұшырады.","distractorIds":["cs27","cs3","cs8"]},{"id":"cs27","date":"XVII ғасырдың басы","event":"Испанияда елдің ұзаққа созылған тоқырау кезеңі басталды.","distractorIds":["cs1","cs4","cs9"]}],"people":[{"id":"william-conqueror","name":"Вильгельм (Жаулап алушы)","clues":["ХІ ғасырда Англияны жаулап алуды басқарды.","1066 жылы Гастингс шайқасында Гарольдті жеңіп, Лондонды басып алып, өзін Англия королі етіп жариялады.","Ағылшын-саксон ақсүйектерінің жерін тартып алып, өз рыцарьларына таратты.","Тауэр қамалын тұрғызды.","1086 жылы «Қаһарлы сот кітабы» бойынша санақ жүргізді."]},{"id":"harold","name":"Гарольд","clues":["Ағылшын королі болды.","1066 жылы Гастингс маңындағы шайқаста Вильгельм әскерінен жеңіліп, қаза тапты."]},{"id":"robin-hood","name":"Робин Гуд","clues":["XIV ғасырдағы балладаларда аталған езілгендердің адал досы."]},{"id":"henry-ii-plantagenet","name":"ІІ Генрих Плантагенет","clues":["Англия королі, 1154-1189 жылдары билік құрды.","Англиямен қатар Франция жерінің 2/3 бөлігін иемденді.","Сот реформасын (король сотын) және әскери реформаны («қалқандық ақша») жүргізді."]},{"id":"henry-iii","name":"III Генрих","clues":["Англия королі, 1216-1272 жылдары билік құрды.","Италияға қарсы соғыс ашып, барондардан табысының 1/3 бөлігін талап етті."]},{"id":"philip-iv-fair","name":"IV Көркем Филипп","clues":["Франция королі, 1285-1314 жылдары билік құрды.","Рим папасына қарсы күресте қолдау табу үшін 1302 жылы Бас штаттарды шақырды."]},{"id":"ferdinand-aragon","name":"Фердинанд","clues":["Арагон королі болды.","1479 жылы Изабеллаға үйленді.","Гранада (1492 ж.) мен Наварраны (1512 ж.) қосып алып, Испанияны біріктірді.","Инквизиция құрды.","1516 жылы қайтыс болды."]},{"id":"isabella-castile","name":"Изабелла","clues":["Кастилия патшайымы болды.","Фердинандқа тұрмысқа шығып, Испанияны біріктіруге, Гранаданы қосып алуға және инквизицияны құруға қатысты."]},{"id":"charles-v-spain","name":"V Карл","clues":["Испания королі, 1516-1556 жылдары билік құрды.","Дүниежүзілік католиктік империя құруды жалғастырды.","Әскер мен флотты күшейтіп, кеңес құрып, абсолюттік тәртіп орнатты."]},{"id":"philip-ii-spain","name":"ІІ Филипп","clues":["Испания королі болды.","Католиктік реакцияны Еуропаға таратуға тырысып, епископтар санын 4-5 есе көбейтті.","1588 жылы Англияға «Жеңілмейтін армада» флотын жіберіп, жеңіліске ұшырады."]}],"chronologySets":[["cs4","cs5","cs7","cs8"],["cs10","cs11","cs13","cs14"],["cs15","cs16","cs17","cs18"],["cs19","cs20","cs21","cs22"],["cs17","cs18","cs19","cs22"]]}