{"schemaVersion":2,"id":"golden-horde","name":"Алтын Орда","period":"medieval","periodLabel":"Орта ғасыр","status":"ready","facts":[{"id":"gh1","date":"1227 жыл","event":"Шыңғыс хан қаза тапқаннан кейін де, оның ұлдары мен немерелері жаулаушылық жорықтарын жалғастыра берді.","distractorIds":["gh2","gh3","gh4"]},{"id":"gh2","date":"1229 жыл","event":"Құрылтай өткізіліп, Шыңғыс ханның үшінші ұлы Үгедей ұлы хан болып сайланды.","distractorIds":["gh3","gh4","gh5"]},{"id":"gh3","date":"1236 жыл (соңы)","event":"Монғолдардың батысқа жорығы басталды. Жошының баласы Бату басқарған әскер Еділ өзенінің жағасындағы Бұлғар елін жаулап алды.","distractorIds":["gh4","gh5","gh6"]},{"id":"gh4","date":"1236-1240 жылдар","event":"Жошы ұлысының билеушісі Батудың басқаруымен монғолдар Еділ бұлғарлары мен орыс жерінің көп бөлігін жаулап алды.","distractorIds":["gh5","gh6","gh7"]},{"id":"gh5","date":"1237 жыл","event":"Еділ мен Дон өзендерінің аралығындағы қыпшақтар тізе бүгіп, 120-140 мың әскермен орыс жеріне шабуылға дайындалды. Қысында Бату әскері Еділ өзенінен өтіп, Рязань және Мәскеу қалаларын алды.","distractorIds":["gh6","gh7","gh8"]},{"id":"gh6","date":"1238 жыл (ақпан)","event":"Бату Владимир қаласын қоршап, үш күннен кейін қаланы алды.","distractorIds":["gh7","gh8","gh9"]},{"id":"gh7","date":"1238 жыл","event":"Ростов, Суздаль, Ярославль, Кострома, Углич, Тверь т.б. 14 қаланы бағындырып, Новгородқа қарап беттеді. Көктемде батпаққа байланысты Бату әскерін оңтүстікке бұрды.","distractorIds":["gh8","gh9","gh10"]},{"id":"gh8","date":"1240 жыл","event":"Бату әскерлері Киев қаласына келіп жетті. Даниил және Дмитрий князьдер мен қала халқы 8 күн қорғағанмен, Киев князьдігі жеңіліске ұшырады.","distractorIds":["gh9","gh10","gh11"]},{"id":"gh9","date":"1240-1480 жылдар","event":"Орыс жерінде монғол-татар үстемдігі орнады.","distractorIds":["gh10","gh11","gh12"]},{"id":"gh10","date":"1241 жыл","event":"Бату мен Субедей бастаған монғол әскері Венгрияға, екінші тобы Польшаға кіріп, Польша мен Силезияны бағындырды, Лигницы маңында неміс мен поляк князьдерінің жасақтарын талқандады. Монғолдар Адриат теңізінің жағасына дейін жетті.","distractorIds":["gh11","gh12","gh13"]},{"id":"gh11","date":"1241-1242 жылдар","event":"Венгрия монғол-татар шапқыншылығына тап болды. Венгр әскерлері Сайо өзенінде талқандалып, Пешт және басқа қалалар қиратылды.","distractorIds":["gh12","gh13","gh14"]},{"id":"gh12","date":"1242 жыл","event":"Монғолдар кейін шығысқа қайтып, ат басын кері бұрды.","distractorIds":["gh13","gh14","gh15"]},{"id":"gh13","date":"1243 жыл","event":"Бату әскерлері Еділ өзенінің төменгі сағасына оралып, Сарай-Бату қаласын салғызды және Алтын Орда мемлекетін құрды.","distractorIds":["gh14","gh15","gh16"]},{"id":"gh14","date":"1312 жыл","event":"Өзбек ханның тұсында ислам діні мемлекеттік дін болып жарияланды.","distractorIds":["gh15","gh16","gh17"]},{"id":"gh15","date":"1312-1342 жылдар","event":"Өзбек ханның билік құрған жылдары.","distractorIds":["gh16","gh17","gh18"]},{"id":"gh16","date":"1320 жылдардың басы","event":"Өзбек хан ислам дінін мемлекеттік дін деп жариялады.","distractorIds":["gh17","gh18","gh19"]},{"id":"gh17","date":"1342-1357 жылдар","event":"Өзбек ханның ұлы Жәнібектің билік құрған жылдары.","distractorIds":["gh18","gh19","gh20"]},{"id":"gh18","date":"1359-1379 жылдар","event":"Алтын Орда тарихында таққа талас нәтижесінде 25 хан ауысып, орыс деректерінде «Ұлы дүрбелең» немесе «Ұлы дағдарыс» кезеңі деп аталды.","distractorIds":["gh19","gh20","gh21"]},{"id":"gh19","date":"1380 жыл","event":"Мәуереннахр әмірі Әмір Темірдің қолдауымен билікке Тоқтамыс ханның келуімен тақ дағдарысы аяқталды.","distractorIds":["gh20","gh21","gh22"]},{"id":"gh20","date":"1382 жыл","event":"Тоқтамыс хан Мәскеуді өртеді / шабуыл жасап, орыс князьдеріне қайтадан салық төлетті.","distractorIds":["gh21","gh22","gh23"]},{"id":"gh21","date":"1389-1391 және 1395 жылдар","event":"Әмір Темірдің (Ақсақ Темірдің) жорықтары нәтижесінде Тоқтамыстың әскері талқандалып, Алтын Орда қалалары жауланып алынды.","distractorIds":["gh22","gh23","gh24"]},{"id":"gh22","date":"1391 мен 1395 жылдар","event":"Әмір Темір Тоқтамыстың әскерін талқандап, Еділ бойындағы қалаларды жаулап алды.","distractorIds":["gh23","gh24","gh25"]},{"id":"gh23","date":"1420 жылдар","event":"Алтын Орданың ыдырауынан Сібір хандығы мен Өзбек хандығы бөлініп шықты.","distractorIds":["gh24","gh25","gh26"]},{"id":"gh24","date":"1438 жыл","event":"Қазан хандығы бөлініп шықты.","distractorIds":["gh25","gh26","gh27"]},{"id":"gh25","date":"1440 жыл","event":"Ноғай ордасы бөлініп шықты.","distractorIds":["gh26","gh27","gh28"]},{"id":"gh26","date":"1441 жыл","event":"Қырым хандығы бөлініп шықты.","distractorIds":["gh27","gh28","gh29"]},{"id":"gh27","date":"1465 жыл","event":"Қазақ хандығы бөлініп шықты.","distractorIds":["gh28","gh29","gh30"]},{"id":"gh28","date":"XIV ғасыр","event":"Алтын Орда қалаларының ерекше гүлденуі осы ғасырға жатады. Алтын Орда монғолдары түркіленіп, татарлар деп аталды.","distractorIds":["gh29","gh30","gh1"]},{"id":"gh29","date":"XIV ғасырдың 1-жартысы","event":"Өзбек және Жәнібек хандар тұсында Алтын Орда өз дамуының шарықтау шегіне жетті.","distractorIds":["gh30","gh1","gh2"]},{"id":"gh30","date":"XV ғасырдың ортасы","event":"Алтын Орда бірте-бірте әлсіреп, ортасына қарай біржолата құлады.","distractorIds":["gh1","gh2","gh3"]}],"people":[{"id":"ogedei","name":"Үгедей","clues":["Шыңғыс ханның үшінші ұлы. 1229 жылы құрылтай өткізіліп, Ұлы хан болып сайланды."]},{"id":"batu","name":"Бату (Батый)","clues":["Жошының баласы/ұлы, Шыңғыс ханның немересі. 1236 жылдың соңында батысқа жорықты басқарды. Бұлғар елін, орыс жерлерін, Киевті жаулап алды. Еуропаға жорық жасап, 1243 жылы Сарай-Бату қаласын салғызып, Алтын Орда мемлекетінің негізін қалады."]},{"id":"daniil-dmitry","name":"Даниил және Дмитрий","clues":["Орыс князьдері. Киев қаласын монғолдардан қорғауды өз қолдарына алып, сегіз күн ерлікпен қорғады."]},{"id":"subedei","name":"Субедей","clues":["Монғол қолбасшысы. 1241 жылы Батумен бірге монғол әскерін бастап Венгрияға кірді."]},{"id":"bela-iv","name":"IV Белла","clues":["Венгр королі. Бату ханның берілу туралы талабын орындамады, Пападан көмек сұрағаннан нәтиже шықпаған соң, Сайо өзенінде әскері талқандалып, өзі сарайымен Далмацияға қашты."]},{"id":"jochi","name":"Жошы","clues":["Шыңғыс ханның үлкен ұлы. Оған Алтын Орда мемлекетін құраған ұлыс бөліп берілген."]},{"id":"berke","name":"Берке","clues":["Хан. Оның тұсында Алтын Орда біртұтас монғол империясынан бөлектеніп, тәуелсіз мемлекет болды. Оның тұсында астана Сарай-Берке деп аталды."]},{"id":"orda-ejen","name":"Орда-Ежен","clues":["Бату ханның ағасы. Бату хан оған Сырдария алқабынан Балқаш көліне дейінгі байтақ жерді берді (Ақ Орда). Өтеміс қажы дерегінде Батумен ұлысты басқаруға келісе алмай Шыңғыс ханға барғанда, оған күміс босағалы «Ақ орда» үйі тиген."]},{"id":"shaybani","name":"Шайбани","clues":["Бату ханның інісі (Жошының бесінші баласы). Оған Арал теңізінің солтүстігіндегі жерлер берілді (Көк Орда). Шыңғыс хан бұйрығымен оған болот босағалы «Көк орда» тиген."]},{"id":"utemis","name":"Өтеміс қажы","clues":["XVI ғасырда «Шыңғыснама» кітабын жазған автор."]},{"id":"genghis","name":"Шыңғыс хан","clues":["Монғол империясының негізін қалаушы, Бату, Орда-Ежен, Шайбанилардың атасы. Немерелері келісе алмай келгенде, үшеуіне үш киіз үй тігіп (ақ үй, ақ орда, көк орда) билікті бөліп берген."]},{"id":"uzbek","name":"Өзбек хан","years":"1312-1342 жж.","clues":["Алтын Орда ханы. Оның билігі тұсында мемлекет гүлденіп, шарықтау шегіне жетті. 1312 жылы ислам дінін мемлекеттік дін деп жариялады. Батыс Еуропа, Азия елдерімен сауданы дамытты."]},{"id":"janibek","name":"Жәнібек хан","years":"1342-1357 жж.","clues":["Өзбек ханның ұлы. Оның билігі кезінде де Алтын Орда гүлденіп, дамудың шарықтау шегіне жетті, керуен саудасы жақсы жүргізілді."]},{"id":"yasawi","name":"Қожа Ахмет Ясауи","clues":["Түркілік сопылықтың негізін қалаушы."]},{"id":"tokhtamysh","name":"Тоқтамыс хан","clues":["1380 жылы Әмір Темірдің қолдауымен Алтын Ордада билікке келіп, «Ұлы дағдарысты» аяқтатты. 1382 жылы Мәскеуге шабуыл жасап өртеді және орыстардан салық төлетті. Кейін Әмір Темірге қарсы шығып, одан жеңіліс тапты."]},{"id":"timur","name":"Әмір Темір (Ақсақ Темір)","clues":["Мәуереннахр әмірі. Алғашында Тоқтамыстың билікке келуіне қолдау көрсетті. Кейін Тоқтамыс өзіне қарсы шыққан соң, 1389-1391, 1395 жылдары жорық жасап, Тоқтамыстың әскерін талқандап, Алтын Орданы қиратты."]}],"chronologySets":[["gh1","gh2","gh3","gh13"],["gh3","gh5","gh8","gh13"],["gh9","gh13","gh14","gh17"],["gh18","gh19","gh20","gh21"],["gh19","gh20","gh23","gh24"],["gh23","gh24","gh25","gh26"],["gh24","gh25","gh26","gh27"],["gh13","gh18","gh19","gh30"]]}