{"schemaVersion":2,"id":"moscow-state","name":"Мәскеу мемлекеті","period":"medieval","periodLabel":"Орта ғасыр","status":"ready","facts":[{"id":"ms1","date":"1260-1270 жылдары","event":"Мәскеу князьдігі Солтүстік-Шығыс Русьтегі Владимирдің ұлы князьдігінен бөлініп шықты.","distractorIds":["ms2","ms3","ms4"]},{"id":"ms2","date":"1263 жылы","event":"Александр Невский қайтыс болған соң Мәскеудің алғашқы князінің тәрбиешісі мен қамқоршысы оның ағасы тверлік ұлы князь Ярослав Ярославич Тверской болды.","distractorIds":["ms1","ms3","ms5"]},{"id":"ms3","date":"1273 жылы","event":"Ағасы қайтыс болған соң, Даниил өзі бетінше билік жүргізе бастады.","distractorIds":["ms2","ms4","ms5"]},{"id":"ms4","date":"1300 жылы","event":"Даниил аяқастынан Рязань князьдігіне шабуыл жасап, Рязань князін тұтқындайды, Коломнаны, Переяславльды, Можайскіні басып алды.","distractorIds":["ms3","ms5","ms6"]},{"id":"ms5","date":"1303 жылы","event":"Даниил қайтыс болды.","distractorIds":["ms4","ms6","ms8"]},{"id":"ms6","date":"1319 жылы","event":"Юрий Алтын Ордадан ұлы князьдік туралы жарлық алып, Русьтің алғашқы (ұлы) князі болды.","distractorIds":["ms5","ms7","ms8"]},{"id":"ms7","date":"1324 жылы","event":"Юрийді Тверь князі өлтіреді, ұлы князьдік туралы жарлық тағы да Тверьге өтеді.","distractorIds":["ms6","ms8","ms9"]},{"id":"ms8","date":"1325 жылы","event":"Юрий Даниилович қаза тапқан соң, Мәскеу князьдігінің билігі оның бауыры Иван Данииловичке берілді.","distractorIds":["ms7","ms9","ms10"]},{"id":"ms9","date":"1327 жылы","event":"Тверь халқы көтерілді.","distractorIds":["ms8","ms10","ms11"]},{"id":"ms10","date":"1332 жылы","event":"Суздаль князі қайтыс болған соң ғана Иван Даниилович Владимирдің ұлы князі атағын иеленді.","distractorIds":["ms8","ms9","ms11"]},{"id":"ms11","date":"1359 жылы","event":"Мәскеу тағына тоғыз жасар Дмитрий Иванович отырды; осы жылы Алтын Орда екіге бөлініп кетті.","distractorIds":["ms10","ms12","ms13"]},{"id":"ms12","date":"1361 жылдан бастап","event":"Дмитрий Иванович Ордаға алым-салық төлеуді және Ордаға баруды тоқтатты.","distractorIds":["ms11","ms13","ms14"]},{"id":"ms13","date":"1380 жылы","event":"Куликов шайқасында Мамайдың жеңіліске ұшырауы Русьтің Алтын Орданың бұғауынан босап, азаттық алуындағы маңызды оқиға болды.","distractorIds":["ms11","ms12","ms14"]},{"id":"ms14","date":"1462-1505 жылдары","event":"III Иван билік құрған кезең.","distractorIds":["ms13","ms15","ms16"]},{"id":"ms15","date":"1505-1533 жылдары","event":"III Василий билік құрған кезең.","distractorIds":["ms14","ms16","ms17"]},{"id":"ms16","date":"XV ғасырда","event":"Мәскеуге Стародуб, Ярослав князьдіктері, Новгород, Тверь қосылды.","distractorIds":["ms14","ms15","ms17"]},{"id":"ms17","date":"XVI ғасырдың басында","event":"Псков пен Рязань жерлері де қосылды.","distractorIds":["ms14","ms15","ms16"]}],"people":[{"id":"alexander-nevsky","name":"Александр Невский","clues":["Русьтің бой көтеріп, қалыптасуында ордамен жақсы қарым-қатынаста болып, өз елдерінің болашағын ойлады. Өз өсиетінде Мәскеуді кіші баласы екі жасар Даниилге табыстады."]},{"id":"daniel-alexandrovich","name":"Даниил (Даниил Александрович)","clues":["Александр Невскийдің кіші баласы. 1300 жылы Рязань князьдігіне шабуыл жасап, Рязань князін тұтқындады. Коломнаны, Переяславльды, Можайскіні басып алып, Мәскеу өзенінің бойындағы маңызды сауда жерлерін қаратты. 1303 жылы қайтыс болды."]},{"id":"yaroslav-tverskoy","name":"Ярослав Ярославич Тверской","clues":["Даниилдің ағасы, тверлік ұлы князь, 1263 жылы Александр Невский қайтыс болған соң Мәскеудің алғашқы князінің (Даниилдің) тәрбиешісі мен қамқоршысы болды."]},{"id":"yuri-danilovich","name":"Юрий Даниилович","clues":["Даниил Александровичтің ұлы, Мәскеу князі болды. 1319 жылы Алтын Ордадан ұлы князьдік туралы жарлық алып, Русьтің алғашқы князі болды. 1324 жылы оны Тверь князі өлтіреді."]},{"id":"mikhail-yaroslavich","name":"Михаил Ярославич","clues":["Тверь князі, Юрий Данииловичпен ашық көрсетуден бас тартты."]},{"id":"ivan-kalita","name":"Иван Даниилович (Иван Калита)","clues":["Юрий Данииловичтің бауыры, 1325 жылы Мәскеу князьдігінің билігі оған берілді. 1327 жылғы Тверьдегі көтерілісті басуға көмектесті. Алтын Ордамен тығыз байланыста болып, алым-салықты өзі жинап отырды, Мәскеуді орыс жеріндегі шіркеудің орталығына айналдырды."]},{"id":"metropolitan-peter","name":"Петр (митрополит)","clues":["Мәскеуде ұзақ өмір сүріп қайтыс болған дінбасы, Мәскеу Кремліндегі Успенск соборына жерленген, Мәскеудің қорғаушысы болып танылған."]},{"id":"dmitry-ivanovich","name":"Дмитрий Иванович","clues":["1359 жылы тоғыз жасында Мәскеу тағына отырды. Ордаға үш мәрте барып ұлы князь деген жарлықты алды. 1361 жылдан бастап Ордаға салық төлеуді және оған баруды тоқтатты."]},{"id":"mamai","name":"Мамай","clues":["Алтын Орданың батыс бөлігінің қолбасшысы. Дмитрий Ивановичке қарсы жазалау шараларын жүргізді. 1380 жылы Куликов шайқасында жеңіліске ұшырады."]},{"id":"ivan-iii","name":"III Иван","years":"1462-1505 жылдары","clues":["Мәскеу маңына біріккен орыс елін күшейтті."]},{"id":"vasily-iii","name":"III Василий","years":"1505-1533 жылдары","clues":["Мәскеу маңына біріккен орыс елін күшейтті."]}],"chronologySets":[["ms2","ms3","ms4","ms5"],["ms5","ms6","ms7","ms8"],["ms6","ms8","ms9","ms10"],["ms8","ms10","ms11","ms12"],["ms11","ms12","ms13","ms14"],["ms13","ms14","ms15","ms17"]]}