{"schemaVersion":2,"id":"byzantine-empire","name":"Византия империясы","period":"medieval","periodLabel":"Орта ғасыр","status":"ready","facts":[{"id":"byz1","date":"324 жыл","event":"Император Константин астананы Рим қаласынан Босфор бұғазындағы Византий деген шағын қалаға көшірді.","distractorIds":["byz2","byz3","byz4"]},{"id":"byz2","date":"330 жыл","event":"Император Константин астананы Босфордағы көне Мегар аймағына көшіріп, жаңа астана оның құрметіне Константинополь деп өзгертілді.","distractorIds":["byz3","byz4","byz5"]},{"id":"byz3","date":"395 жыл","event":"Рим империясы ресми түрде Батыс және Шығыс болып екіге бөлініп кетті. Император Феодосий қайтыс болып, империяның батысын ұлы Гонорийге, шығысын Аркадийге мұра етіп қалдырды.","distractorIds":["byz4","byz5","byz6"]},{"id":"byz4","date":"407 жыл","event":"Батыс және Шығыс Рим империялары арасында соғыс өрті тұтанып кете жаздады.","distractorIds":["byz5","byz6","byz7"]},{"id":"byz5","date":"415 жыл","event":"Византияның Батыс Рим империясымен қатынасы біраз шиеленісіп, тыныштық бұзыла бастады.","distractorIds":["byz6","byz7","byz8"]},{"id":"byz6","date":"V ғасырдың 40-жылдары","event":"Ғұндар білігі күшейіп, ғұндар Константинопольді басып алу қаупін туғызды.","distractorIds":["byz7","byz8","byz9"]},{"id":"byz7","date":"442 жыл","event":"Шығыстағы көшпелілердің шабуылы Византияны парсы үкіметімен бітімшартын жасауға мәжбүрледі.","distractorIds":["byz8","byz9","byz10"]},{"id":"byz8","date":"467 жыл","event":"Византия дипломатиясы Батыс Рим империясының тағына өз ықпалындағы императорды отырғызып, готтарға қарсы бірлесе күресу мүмкіндігіне қол жеткізді.","distractorIds":["byz9","byz10","byz11"]},{"id":"byz9","date":"527–565 жылдар","event":"І Юстинианның билік еткен кезеңі. Византия империясы қайта күшейді.","distractorIds":["byz10","byz11","byz12"]},{"id":"byz10","date":"529 жыл","event":"Юстиниан «Азаматтық құқықтар жинағын» жазуға кірісіп, арнаулы топ құрып, заңдарды жинақтап, жарлық берді.","distractorIds":["byz11","byz12","byz13"]},{"id":"byz11","date":"532 жыл","event":"Константинополь қаласында венетер мен прасиндер партияларының басшылығымен «Ника» («жеңу») көтерілісі болды.","distractorIds":["byz12","byz13","byz14"]},{"id":"byz12","date":"532–537 жылдар","event":"Юстиниан Константинопольде Әулие София соборын (храмын) салғызды.","distractorIds":["byz13","byz14","byz15"]},{"id":"byz13","date":"534 жыл","event":"Юстиниан Солтүстік Африкадағы вандалдар королевствосын талқандады.","distractorIds":["byz14","byz15","byz16"]},{"id":"byz14","date":"535–555 жылдар","event":"І Юстиниан Италияны остготтардан тазартты, Испания үшін вестготтармен шайқасты.","distractorIds":["byz15","byz16","byz17"]},{"id":"byz15","date":"540–562 жылдар аралығы","event":"Византия Иранмен соғысты.","distractorIds":["byz16","byz17","byz18"]},{"id":"byz16","date":"681 жыл","event":"Фракияда, Македонияда орнығып алған славяндар Византияның солтүстік-шығысында алғашқы славян мемлекеті — Болгария патшалығын құрды.","distractorIds":["byz17","byz18","byz19"]},{"id":"byz17","date":"860 жыл","event":"Орыстар Константинополь қаласына дейін келіп, Византиямен келісім жасасып, кері қайтты.","distractorIds":["byz18","byz19","byz20"]},{"id":"byz18","date":"907 жыл","event":"Орыстар тағы да қала маңындағы елді мекендерді тонап, «грек отының» көмегімен талқандалды.","distractorIds":["byz19","byz20","byz21"]},{"id":"byz19","date":"988 жыл","event":"Киев Русі Византиядан христиан дінін қабылдады.","distractorIds":["byz20","byz21","byz22"]},{"id":"byz20","date":"IV ғасырдың ортасы","event":"Христиан діні бүкіл Византия империясына ресми дін болып танылды.","distractorIds":["byz21","byz22","byz23"]},{"id":"byz21","date":"VII ғасырға дейін","event":"Византияда латын тілі мемлекеттік тіл болды (кейін грек тілі ығыстырды).","distractorIds":["byz22","byz23","byz24"]},{"id":"byz22","date":"VII ғасырдың 30-жылдарынан бастап","event":"Арабтар Византияға қауіп төндіріп, Сирия, Палестина, Месопотамия, Египетті тартып алды.","distractorIds":["byz23","byz24","byz1"]},{"id":"byz23","date":"VIII ғасырдың ортасы","event":"Византия арабтарға қарсы күресте біраз жеңістерге жетіп, Сирияны қайтарды.","distractorIds":["byz24","byz1","byz2"]},{"id":"byz24","date":"VIII ғасырдың аяғы","event":"Византияға орыстардың шапқыншылығы басталды.","distractorIds":["byz1","byz2","byz3"]}],"people":[{"id":"constantine","name":"І Константин","clues":["324 (330) жылы астананы Рим қаласынан Босфор бұғазындағы Византий қаласына көшірді. Жаңа астана оның құрметіне Константинополь деп аталды."]},{"id":"theodosius","name":"І Феодосий","clues":["395 жылы қайтыс болып, Рим империясын Батыс бөлігін ұлы Гонорийге, Шығыс бөлігін ұлы Аркадийге мұра етіп қалдырды."]},{"id":"honorius","name":"Гонорий","clues":["І Феодосийдің ұлы. 395 жылы Рим империясының батыс бөлігінің мұрагері болды."]},{"id":"arcadius","name":"Аркадий","clues":["І Феодосийдің ұлы. 395 жылы Рим империясының шығыс бөлігінің мұрагері болды."]},{"id":"justinian","name":"І Юстиниан","years":"527–565 жж.","clues":["527–565 жылдары Византияны билеген император. Македонияда қарапайым шаруа отбасында туған. Рим империясын қайта қалпына келтіру үшін соғысып, Италия, Солтүстік Африка, Испанияның оңтүстік-батысын қосып алды. «Азаматтық құқықтар жинағын» жаздырды. 532–537 жылдары Әулие София соборын салғызды. Аграрлық реформа жүргізді, жібек өндіруді жолға қойды."]},{"id":"justin","name":"Юстин","clues":["Юстинианның ағасы. Әскерге аттанып, әскери мансабын дамытты. Билікке келген соң інісі Юстинианды билікке тартып, өз мұрагері етті."]},{"id":"attila","name":"Аттила","clues":["Ғұн билеушісі. V ғасырдың 40-жылдары оның әскері келісімді жиі бұзып, Константинопольді басып алу қаупін туғызды."]},{"id":"ishtemi","name":"Иштеми","clues":["Түрік қағаны. Константинопольге көпес Маниах басқарған елшілік жіберді. Византия елшісі Земархты қабылдап, Иранға қарсы бірлесіп қимылдау және сауда мәселелері бойынша келіссөз жүргізді."]},{"id":"maniah","name":"Маниах","clues":["Көпес. Түрік қағаны Иштеми Византияға жіберген елшілікті басқарды."]},{"id":"justin2","name":"ІІ Юстин","clues":["Византия императоры. Түрік қағанатымен дипломатиялық қарым-қатынас жасап, елшіліктерді қабылдады."]},{"id":"zemarch","name":"Земарх","clues":["Византия елшісі. Түрік қағанатына аттанып, Каспий теңізін жағалап, Хорезм арқылы Сырдарияға жетіп, Иштеми қағанмен келіссөз жүргізді."]}],"chronologySets":[["byz1","byz2","byz3","byz4"],["byz4","byz5","byz7","byz8"],["byz9","byz10","byz11","byz13"],["byz11","byz12","byz13","byz14"],["byz13","byz14","byz15","byz16"],["byz16","byz17","byz18","byz19"],["byz22","byz23","byz24","byz17"]]}