{"schemaVersion":2,"id":"ancient-religious-beliefs","name":"Ежелгі діни нанымдар","period":"ancient","periodLabel":"Ежелгі заман","status":"ready","facts":[{"id":"arb1","date":"VI–VII ғасырлар","event":"Жапонияда жапондықтардың ұлттық діні — Синтоизм қалыптасты.","distractorIds":["arb2","arb3","arb4"]},{"id":"arb2","date":"VII–VIII ғасырлар","event":"Жапониядағы мифологиялық ескерткіштер синтоистік культтер жүйесінің қалыптасуына ықпал етті.","distractorIds":["arb1","arb3","arb4"]},{"id":"arb3","date":"Б.з.б. 2 мыңжылдықтан бұрын","event":"Үндістанның діни нанымының алғашқы кезеңі ведалық дін қалыптасты. Үндістанға арийлік тайпалар енді.","distractorIds":["arb2","arb4","arb5"]},{"id":"arb4","date":"Б.з.б. 1-мыңжылдық","event":"Үндістанда индуизм діни және діни-философиялық жүйелердің кешені ретінде қалыптасты.","distractorIds":["arb3","arb5","arb6"]},{"id":"arb5","date":"Б.з VI–V ғасырлар","event":"Индуизмнің қалыптасуындағы соңғы үшінші кезең келді. Брахманизм дін ретінде өзгеріп, индуизм атауын алды.","distractorIds":["arb4","arb6","arb7"]},{"id":"arb6","date":"ХХ ғасырдың соңы","event":"Әлемде индуизмді ұстанушылар саны 800 миллион адамды құрады.","distractorIds":["arb5","arb7","arb8"]},{"id":"arb7","date":"Б.з.б. 2-мыңжылдық","event":"Еврейлер политеистер болды, түрлі құдайлар мен рухтарға сенді.","distractorIds":["arb6","arb8","arb9"]},{"id":"arb8","date":"Б.з.б. 1-мыңжылдық","event":"Палестинада еврейлер арасында иудаизм діні пайда болды.","distractorIds":["arb7","arb9","arb10"]},{"id":"arb9","date":"Б.з.б. ХІ ғ. соңы – Х ғ. бірінші жартысы","event":"Израиль-Иудей мемлекеті аса қуатты елге айналды.","distractorIds":["arb8","arb10","arb11"]},{"id":"arb10","date":"Б.з.б. Х ғасыр","event":"Давидтің ұлы Соломон Иерусалимде құдайдың құрметіне ғибадатхана тұрғызды. Танахтың ең ежелгі бөлігі осы кезеңге жатады.","distractorIds":["arb9","arb11","arb12"]},{"id":"arb11","date":"Б.з.б. 621 жыл","event":"Иудей патшасы Иосий бір құдайдан басқаларға табынуға тыйым салып, монотеизмнің ресми басталуы туралы жарлық шығарды.","distractorIds":["arb10","arb12","arb13"]},{"id":"arb12","date":"Б.з.б. ІІІ–ІІ ғасырлар","event":"Қасиетті жазбаны Танахты қағидаға айналдыру жұмысы иврит тілінде толық аяқталды.","distractorIds":["arb11","arb13","arb14"]},{"id":"arb13","date":"Б.з. ІІ ғасыр","event":"Еврейлердің римдіктермен соғыста жеңіліс табуы және Палестинадан жаппай қоныс аударуы басталды.","distractorIds":["arb12","arb14","arb15"]},{"id":"arb14","date":"ІІ ғасырдың соңы – III ғасырдың басы","event":"Торадағы түсініктер негізінде еврейлерге арналған заңдар мен моральдық-этикалық кодекс Талмуд жинағы құрастырылды.","distractorIds":["arb13","arb15","arb16"]},{"id":"arb15","date":"Б.з.б. 1-мыңжылдық","event":"Зороастризм діні Иран, Ауғанстан, Орталық Азия және басқа аймақтарда қалыптасты.","distractorIds":["arb14","arb16","arb17"]},{"id":"arb16","date":"216–277 жылдар","event":"Манихейлік дінінің негізін салушы Манидің өмір сүрген жылдары.","distractorIds":["arb15","arb17","arb18"]},{"id":"arb17","date":"Б.з.б. VI–V ғасырлар","event":"Қытайда философ Лао-цзы өмір сүрді және оның «дао — даналық жолы» ілімі пайда болды.","distractorIds":["arb14","arb16","arb18"]},{"id":"arb18","date":"Б.з. II ғасыры","event":"Чжан Дао-Лин Лао-цзының іліміне сүйене отырып, Даосизмді дербес қытайлық дін ретінде қалыптастырды.","distractorIds":["arb15","arb16","arb17"]}],"people":[],"terms":[{"id":"shinto","name":"Синтоизм","clues":["VI–VII ғасырларда қалыптасқан жапондықтардың ұлттық діні. «Синто» — «құдай жолы». Негізін табиғат құдіреті мен бабалар культі құрайды."]},{"id":"kami","name":"Ками","clues":["Синто ілімі бойынша табиғатта бар сансыз көп рухтар мен құдайлар жиынтығы."]},{"id":"udzigami","name":"Удзигами","clues":["Өмірден өткен бабалар культінің ең бастысы, ең алғашқы бабалар тегі."]},{"id":"tenno","name":"Тэнно / Микадо","clues":["Жапон императорлары өздерінің тектерін Күн құдайы Аматерасудың немересі Нинигиден бастап, өздерін осылай атаған."]},{"id":"tsumi","name":"Цуми","clues":["Синтодағы нақты күнә. Әлемдік тәртіптің бұзылуы деп саналады және арнайы тазару салтын қажет етеді."]},{"id":"hinduism","name":"Индуизм","clues":["Б.з.б. 1-мыңжылдықта Үндістанда қалыптасқан, ведалық дін мен брахманизмнен бастау алатын күрделі діни және діни-философиялық жүйелер кешені."]},{"id":"vedas","name":"Ведалар","clues":["Үндістанның әлемдегі ең көне қасиетті мәтіндері. Ригведа, Самаведа, Яджурведа және Ахтарваведадан тұрады."]},{"id":"karma","name":"Карма","clues":["Адамның тірі кезінде жасаған жақсы және жаман әрекеттері үшін келесі өмірінде жауап беретіндігі туралы заңдылық."]},{"id":"moksha","name":"Мокша","clues":["Жанның шексіз қайта туылу ағымынан біржола босап, жоғары мақсатқа жетуі."]},{"id":"dharma","name":"Дхарма","clues":["«Ману заңдарына» сәйкес адамның атқаруы тиіс міндетті заңы мен парызы."]},{"id":"trimurti","name":"Үшбірлік","clues":["Индуизмдегі Брахма, Вишна және Шива құдайларының бірлігі."]},{"id":"judaism","name":"Иудаизм","clues":["Еврейлердің Иуда тегінің атауынан шыққан, «құдай таңдау» идеясына негізделген монотеистік діндердің бірі."]},{"id":"tanakh","name":"Танах","clues":["Еврейлердің қасиетті жазбасы. Оған Тора, Нәвиим және Кэтувим кіреді."]},{"id":"rabbis","name":"Раввиндер","clues":["Еврей қауымдарына жетекшілік ететін, дін мен заңдарды түсіндіретін дін қызметкерлері."]},{"id":"talmud","name":"Талмуд","clues":["Торадағы түсініктер негізінде жасалған заң шығару, сот істері мен моральдық-этикалық қағидалар жинақталған діни кодекс."]},{"id":"zoroastrianism","name":"Зороастризм","clues":["Негізін Заратуштра пайғамбар қалаған, жақсылық пен жамандықтың мәңгілік күресіне негізделген дін."]},{"id":"avesta","name":"Авеста","clues":["Зороастризмнің қасиетті кітабы. Ең көне бөлігі Гатулар деп аталады."]},{"id":"ahuramazda","name":"Ахурамазда","clues":["Зороастризмдегі жарық пен жақсылықтың Жаратушы құдайы."]},{"id":"spentamanyu","name":"Спентаманью","clues":["Ахурамазданың қасиетті рухы."]},{"id":"ahriman","name":"Анграман (Ахриман)","clues":["Зороастризмдегі қараңғылық пен жауыздықтың рухы, жамандықтың бастаушысы."]},{"id":"daivas","name":"Дайвтар","clues":["Ахриманның әскерлері, әлемге жауыздық, азап, кедейлік пен ауру тарататын жын-перілер мен шайтандар."]},{"id":"manichaeism","name":"Манихейлік","clues":["Негізін Мани қалаған, зороастризм, христиандық және гностицизм идеялары біріккен діни-философиялық ағым."]},{"id":"chosen-asceticism","name":"«Таңдамалы» тақуалық","clues":["Манихейліктегі нағыз тақуаларға қойылатын талап: жеке дүниесі, отбасы, баспанасы болмауы, ет жемеу, шарап ішпеу және тірі өсімдіктерді зақымдамау."]},{"id":"daoism","name":"Даосизм","clues":["Ақыл мен әрекет, рух пен материя, сана мен өмір біртұтас бірлікке жинақталған қытайлық дәстүрлі діни-философиялық жүйе."]},{"id":"nonaction","name":"Әрекетсіздік","clues":["Даосизмдегі табиғат заңдылығына қарсы келмей, ғарышпен үйлесімділікке бағытталған үлкен ішкі жұмыс."]},{"id":"immortality","name":"Ажалсыздық","clues":["Денені медитация, тыныс алу және дао йогасы арқылы шыңдап, мәңгілік өмірге жету сенімі."]}],"chronologySets":[["arb1","arb2","arb3","arb4"],["arb7","arb8","arb9","arb10"],["arb10","arb11","arb12","arb13"],["arb13","arb14","arb15","arb16"],["arb15","arb16","arb17","arb18"]]}