{"schemaVersion":2,"id":"genghis-khan","name":"Шыңғыс хан","period":"medieval","periodLabel":"Орта ғасыр","status":"ready","facts":[{"id":"gh1","date":"1155 жыл","event":"Есугей батыр татар тайпасына шабуыл жасап, Темужін атты батырды тұтқынға түсірді. Сол жылы туған ұлының атын Темужін деп қойды.","distractorIds":["gh2","gh3","gh4"]},{"id":"gh2","date":"1155 (1162)-1227 жылдар","event":"Темужіннің (Шыңғыс ханның) өмір сүрген жылдары.","distractorIds":["gh1","gh3","gh5"]},{"id":"gh3","date":"1170-1223 жылдар","event":"Жалайыр тайпасынан шыққан ұлы қолбасшы Мұқалидың өмір сүрген жылдары.","distractorIds":["gh1","gh2","gh4"]},{"id":"gh4","date":"1190-1206 жылдар","event":"Темужін көптеген түркі-монғол тайпаларын (татарлар, керейттер, меркіттер, наймандар т.б.) өзіне бағындырды.","distractorIds":["gh3","gh5","gh6"]},{"id":"gh5","date":"1206 жыл","event":"Онон өзені бойындағы Құрылтайда Темужін «Шыңғыс хан» деген атпен ұлы хан болып сайланды.","distractorIds":["gh4","gh6","gh7"]},{"id":"gh6","date":"1207 жыл","event":"Енисей жағалауындағы ойрат т.б. тайпалар бағындырылды.","distractorIds":["gh5","gh7","gh11"]},{"id":"gh7","date":"1211 жыл (ақпан)","event":"Монғол әскері Цзинь империясының (Солтүстік Қытай) шекаралық бекінісін бұзып, Солтүстік Қытайды жаулап алуды бастады.","distractorIds":["gh8","gh9","gh10"]},{"id":"gh8","date":"1211-1220 жылдар","event":"Қытайға қарсы соғыстың 1-кезеңі: Солтүстік Қытайдың үлкен бөлігі мен Пекин жаулап алынды.","distractorIds":["gh7","gh9","gh10"]},{"id":"gh9","date":"1211-1279 жылдар","event":"Монғолдардың Қытайды жаулау соғыстары созылып, нәтижесінде бүкіл Қытай Монғол империясына қосылды.","distractorIds":["gh7","gh8","gh25"]},{"id":"gh10","date":"1215 жыл","event":"Монғолдар Пекинді алды / Цзинь империясын толық тізе бүктірді. Солтүстік Қытайда Мұқали 23 мың әскермен қалды.","distractorIds":["gh7","gh8","gh11"]},{"id":"gh11","date":"1217 жыл","event":"Жетісу жеріне Жебе ноян басқарған монғол әскері жіберілді.","distractorIds":["gh10","gh12","gh13"]},{"id":"gh12","date":"1218 жыл","event":"Жетісуда бекіген наймандар бағындырылды; Күшлік жеңіліс тауып, Жетісу монғолдар қолына өтті.","distractorIds":["gh11","gh13","gh14"]},{"id":"gh13","date":"1219 жыл","event":"Монғолдар Қазақстан мен Орта Азияны жаулауды бастады. Күзінде Отырар қаласын қоршауға алды.","distractorIds":["gh12","gh14","gh15"]},{"id":"gh14","date":"1219-1221 жылдар","event":"Монғолдар 3 жылдың ішінде Орта Азияны толық басып алды.","distractorIds":["gh13","gh15","gh17"]},{"id":"gh15","date":"1220 жыл","event":"Қарақорым қаласының іргесі қаланды. Бұхара, Самарқанд алынды. Монғол әскері Хорезмшах Мұхаммедті қуа отырып, Иранға кірді.","distractorIds":["gh14","gh16","gh17"]},{"id":"gh16","date":"1220-1221 жылдар","event":"Жебе мен Сүбедей әскері Жалал ад-диннің ізіне түсіп, Хорасан, Грузия, Әзірбайжанға өтті.","distractorIds":["gh15","gh17","gh18"]},{"id":"gh17","date":"1221 жыл","event":"Орта Азияның соңғы қаласы Мерв құлады. Монғолдар Әзірбайжан мен Грузияны талқандап, Қырымға жетті.","distractorIds":["gh14","gh16","gh18"]},{"id":"gh18","date":"1221-1222 жылдар","event":"Монғолдар Солтүстік Иран, Әзірбайжан және Солтүстік Кавказды жаулап алды.","distractorIds":["gh16","gh17","gh19"]},{"id":"gh19","date":"1223 жыл","event":"Қалқа өзеніндегі шайқаста монғолдар орыс-қыпшақ әскерін талқандады. Қырым мен Чернигов князьдігін қиратып, Монғолияға қайтты.","distractorIds":["gh17","gh18","gh20"]},{"id":"gh20","date":"1225 жыл","event":"Шыңғыс хан Орта Азияны басқаруды Яловачка тапсырып, Қарақорымға оралды.","distractorIds":["gh19","gh21","gh22"]},{"id":"gh21","date":"1226 жыл","event":"Шыңғыс хан Батыс Си Ся (танғұттарға) мемлекетіне соңғы жорығын жасады.","distractorIds":["gh20","gh22","gh23"]},{"id":"gh22","date":"1227 жыл","event":"Танғұттар толық бағындырылды. Шыңғыс хан 72 жасында қаза тапты. Осы жылы Жошы да қайтыс болды.","distractorIds":["gh21","gh23","gh24"]},{"id":"gh23","date":"1227-1234 жылдар","event":"Қытайға соғыстың 2-кезеңі: Танғұттар жойылып, 1234 жылы Цзинь империясы жойылды.","distractorIds":["gh22","gh24","gh25"]},{"id":"gh24","date":"1235 жыл","event":"Қарақорым құрылтайында Батысқа (Еуропаға) жорық жасау ұйғарылды.","distractorIds":["gh23","gh25","gh26"]},{"id":"gh25","date":"1235-1279 жылдар","event":"Қытайға соғыстың 3-кезеңі: Оңтүстік Қытайдағы Сұң империясы толық бағындырылды.","distractorIds":["gh9","gh23","gh24"]},{"id":"gh26","date":"1236 жыл","event":"Батысқа (Бату бастаған) жорық басталды.","distractorIds":["gh23","gh24","gh25"]}],"people":[{"id":"yesugei","name":"Есугей батыр","clues":["Темужіннің әкесі. Қият-бөріжіген тайпасының көсемі. 1155 жылы татарларға шабуылдап, тұтқынға алған батырдың құрметіне жаңа туған ұлына Темужін деп ат қойған."]},{"id":"temujin","name":"Темужін (Шыңғыс хан)","years":"1155 (1162)-1227 жж.","clues":["Түркі-монғол тайпаларын біріктіріп, 1206 жылы Ұлы хан болып сайланды. Империяны оң/сол қанаттарға бөлді. «Яса» («Жасақ») заңын шығарды. Орта Азия, Қытай, Сібір жерлерін жаулап алып, Ұлы Монғол империясын құрды."]},{"id":"toghrul","name":"Тоғрыл","clues":["Керейіттер ханы. ХІІ ғасырдың соңғы ширегінде Темүжінге монғол тайпаларын біріктіру күресінде біраз уақыт қолдау көрсеткен."]},{"id":"kuchlug","name":"Күшлік","clues":["Наймандардың ханзадасы. Жетісудағы Батыс Ляо мемлекетіндегі билікті тартып алып, жергілікті мұсылмандарға қысым жасады. 1218 жылы Жебе нояннан жеңілді."]},{"id":"jebe","name":"Жебе (ноян)","clues":["Шыңғыс ханның қолбасшысы. Жетісуға жіберіліп, Дін бостандығы ұранымен Күшлікті жеңді. Субедеймен бірге Кавказ, Қырым, Орта Азия, Қалқа шайқастарына қатысты."]},{"id":"subedei","name":"Субедей (баһадүр)","clues":["Монғол қолбасшысы. Жебемен бірге Әзірбайжан, Грузия, Кавказ, Қырым жерлерін талқандап, 1223 жылы Қалқа өзенінде орыс-қыпшақ әскерін жеңді."]},{"id":"muqali","name":"Мұқали (Мұқылай)","years":"1170-1223 жж.","clues":["Жалайыр тайпасынан шыққан қолбасшы. Шыңғыс хан батысқа кеткенде Солтүстік Қытайдың билеушісі етіп қалдырды. Оған «Го Уаң» (ұлы князь) атағы берілді."]},{"id":"ghayir-khan","name":"Ғайыр хан","clues":["Отырар қаласының әмірі. 20 мың әскерімен Отырарды монғолдардан 6 ай бойы қорғады."]},{"id":"yalavach","name":"Яловач","clues":["Хорезм көпесі. 1225 жылы Шыңғыс хан Орта Азиядағы иеліктерді басқаруды осы Яловачқа тапсырды."]},{"id":"sons","name":"Жошы, Шағатай, Үгедей, Төле","clues":["Шыңғыс ханның ұлдары. Шыңғыс хан жаулап алған кең-байтақ жерлерді осы төрт ұлына бөліп берді."]},{"id":"batu","name":"Бату (Батый)","clues":["Жошының ұлы. Жошы өлген соң орнына отырып, 1236 жылы Батысқа (Еуропаға) жорық бастады. 1243 жылы Сарай-Бату қаласын салды."]},{"id":"muhammad-khwarazm","name":"Мұхаммед","clues":["Хорезм шахы. 1220 жылы монғол әскері оны қуа отырып Иран жеріне кірді."]},{"id":"jalal-ad-din","name":"Жалал ад-дин","clues":["Хорезмшахтың мұрагері. Жебе мен Сүбедей оның ізіне түсіп жорық жасаған."]}],"chronologySets":[["gh1","gh4","gh5","gh6"],["gh5","gh7","gh10","gh11"],["gh11","gh12","gh13","gh15"],["gh13","gh15","gh17","gh19"],["gh15","gh17","gh19","gh20"],["gh19","gh20","gh21","gh22"],["gh22","gh23","gh24","gh26"],["gh5","gh12","gh19","gh22"]]}