{
  "schemaVersion": 2,
  "id": "america-australia-oceania-traditional-civilization",
  "name": "Америка, Аустралия және Мұхит аралдарындағы дәстүрлі өркениет",
  "period": "medieval",
  "periodLabel": "Орта ғасыр",
  "status": "ready",
  "facts": [
    {"id":"ao1","date":"30 мың жыл бұрын","event":"Америка материгіне ең алғашқы адамдар Азиядан қос құрлықты жалғап жатқан шағын мүйіс арқылы өтті.","distractorIds":["ao2","ao3","ao5"]},
    {"id":"ao2","date":"40-50 мың жыл бұрын","event":"Австралияның тұрғылықты халқы материкке Оңтүстік-Шығыс Азиядан келген.","distractorIds":["ao1","ao3","ao5"]},
    {"id":"ao3","date":"б.з.д. 300 жылдар","event":"Кең тараған болжам бойынша, алғашқы полинезиялықтар Маркиз аралдарынан Гавай аралдарына келген.","distractorIds":["ao4","ao5","ao6"]},
    {"id":"ao4","date":"б.з. ғасыры","event":"Майя мәдениетінің жоғары жетістігі — буындық жазу пайда болды.","distractorIds":["ao3","ao5","ao6"]},
    {"id":"ao5","date":"б.з. алғашқы ғасыры","event":"Қытай қоныстанушыларының қысымы артып, полинезиялықтардың бабалары жаңа аралдар іздеуге мәжбүр болды.","distractorIds":["ao3","ao4","ao6"]},
    {"id":"ao6","date":"VIII ғасыр","event":"Таитиликтің бабаларында тайпалық одақ қалыптасып, этникалық топтасу аяқталды.","distractorIds":["ao5","ao7","ao8"]},
    {"id":"ao7","date":"1125 жылы","event":"Таитилік абыз Паао Гавай аралдарына келіп жетті.","distractorIds":["ao6","ao8","ao9"]},
    {"id":"ao8","date":"1248 жылы","event":"Ацтектер Мехиконың солтүстік алқабына Чапультепекте келіп қоныстанды.","distractorIds":["ao7","ao9","ao10"]},
    {"id":"ao9","date":"1300 жылдары","event":"Таитиден қоныстанушылар Гавай аралдарына келді.","distractorIds":["ao8","ao10","ao11"]},
    {"id":"ao10","date":"1325 жылы","event":"Ацтектер аралдағы Тескоко өзені маңында Теночтитлан елді мекенінің негізін қалайды.","distractorIds":["ao9","ao11","ao12"]},
    {"id":"ao11","date":"1428 жылы","event":"Ицкоатль көсемнің басқаруымен ацтектер көршілес тайпаларға жасаған жорықтарда жеңіске жетіп, үш тайпаның бірлестігін құрады.","distractorIds":["ao10","ao12","ao13"]},
    {"id":"ao12","date":"1438-1463 жылдар","event":"Пачакутидің әрекеттері арқасында инктердің дәуірлеуі басталады.","distractorIds":["ao11","ao13","ao14"]},
    {"id":"ao13","date":"XV ғасырдың екінші жартысынан кейін","event":"Ацтектер қоғамының дәуірлеуі мен мәдениетінің көркеюі басталады.","distractorIds":["ao12","ao14","ao15"]},
    {"id":"ao14","date":"XVI ғасырдың екінші жартысы","event":"Географтардың қате пікірінен Жаңа Гвинея мен Отты Жер «Terra australis incognita - белгісіз Оңтүстік Жер» деп саналды.","distractorIds":["ao13","ao15","ao12"]},
    {"id":"ao15","date":"ХІХ ғасырдың басы","event":"Таити мен оған жақын аралдарда алғашқы мемлекеттік құрылым қалыптасты.","distractorIds":["ao14","ao13","ao12"]}
  ],
  "people": [
    {"id":"christopher-columbus","name":"Христофор Колумб","clues":["Өз сапары барысында Гондурас жағалауынан маталар, какао және металл бұйымдарын артқан, Юкатанда ойып жасалған кемені кездестірді."]},
    {"id":"itzamna","name":"Ицамна","clues":["Аспан бейнесіндегі майя құдайлар құдіретінің шыңы; онымен бірге құнарлылық құдайы да қатар қойылды."]},
    {"id":"atahualpa","name":"Атауальпа","clues":["Инктердің тарихи аңызында айтылатын инктің соңғы жоғарғы билеушісі."]},
    {"id":"pachacuti","name":"Пачакути","clues":["Инктер туралы тоғызыншы билеуші; оның әрекеттері арқасында инктердің дәуірлеуі басталып, мемлекет қалыптасты."]},
    {"id":"itzcoatl","name":"Ицкоатль","clues":["Ацтектердің көсемі; 1428 жылы оның басқаруымен көршілес тайпаларға жасаған жорықтарда жеңіске жетіп, үш тайпаның бірлестігін құрды."]},
    {"id":"huitzilopochtli","name":"Уицилопочтли","clues":["Ацтектердің теночтықтардың жебеуші құдайы әрі Күн құдайы және соғыс құдайы."]},
    {"id":"bernal-diaz-del-castillo","name":"Берналь Диас дель Кастильо","clues":["Испан жауынгері; Теночтитландағы басты базар туралы өз жазбасында жазып кеткен."]},
    {"id":"ferdinand-magellan","name":"Фернан Магеллан","clues":["Отты Жерді ашқан саяхатшы."]},
    {"id":"te-rangi-hiroa","name":"Те-Ранги-Хироа (Питер Бак)","clues":["Жаңазеландиялық ғалым; оның зерттеуі полинезиялықтардың тарихын қалпына келтіруге мүмкіндік береді."]},
    {"id":"paao","name":"Паао","clues":["Таитилік абыз; 1125 жылы Гавай аралдарына келіп жетіп, жаңа діннің негізін қалады.","Жергілікті билеушіге қарсы күресу үшін Пилиді көмекке шақырды."]},
    {"id":"pili","name":"Пили","clues":["Таитиліктердің көсемі; Пааоның шақыруымен келіп, жауыз билеушіні тақтан түсіріп, өзі король сайланды."]},
    {"id":"kamehameha","name":"Камехамеха","clues":["Гавай королі; оның кезінде гавайлық жергілікті билеушілер барлық аралдардың басын қайта біріктіруге әрекет жасап, мақсатына жетті."]}
  ],
  "chronologySets": [
    ["ao3","ao6","ao7","ao8"],
    ["ao6","ao7","ao8","ao10"],
    ["ao7","ao8","ao10","ao11"],
    ["ao8","ao10","ao11","ao12"],
    ["ao10","ao11","ao12","ao13"],
    ["ao11","ao12","ao13","ao14"],
    ["ao12","ao13","ao14","ao15"]
  ]
}