{"schemaVersion":2,"id":"feudal-state-development-stages","name":"Феодалдық мемлекеттердің даму кезеңдері","period":"medieval","periodLabel":"Орта ғасыр","status":"ready","facts":[{"id":"fs1","date":"V ғасырдың ІІ жартысы - VII ғасырдың басы","event":"Британияда бірнеше варварлық англосаксон корольдіктері пайда болды.","distractorIds":["fs2","fs3","fs8"]},{"id":"fs2","date":"VI ғасырдың соңында","event":"Италия аумағының басым бөлігін лангобардтар жаулап алды.","distractorIds":["fs1","fs4","fs9"]},{"id":"fs3","date":"VII ғасырдың аяғынан бастап","event":"Англосаксон мемлекеттерінде феодалдану үдерісі жүре бастады.","distractorIds":["fs2","fs5","fs10"]},{"id":"fs4","date":"709 жылы","event":"Арабтар Вестгот корольдігінің аумағына келіп түсті.","distractorIds":["fs5","fs6","fs8"]},{"id":"fs5","date":"711 жылы","event":"Арабтар мен берберлердің Испанияны жаулап алуы басталды.","distractorIds":["fs4","fs6","fs9"]},{"id":"fs6","date":"755 жылға дейін","event":"Мұсылмандық Испания Дамаск халифатының құрамына кірді.","distractorIds":["fs5","fs7","fs10"]},{"id":"fs7","date":"756 жылы","event":"Папа мемлекеті пайда болды.","distractorIds":["fs6","fs8","fs11"]},{"id":"fs8","date":"843 жылы","event":"Верден келісімшарты Француз корольдігінің негізін қалады.","distractorIds":["fs7","fs9","fs12"]},{"id":"fs9","date":"VIII-IX ғасырларда","event":"Италияда феодалдық қатынастардың қалыптасуы жүрді.","distractorIds":["fs8","fs10","fs13"]},{"id":"fs10","date":"ІХ ғасырда","event":"1. Нормандар Солтүстік Германияны, Францияны, Англияны тонап отырды.\n2. Шығыс славяндардың басын қосқан орыс мемлекеті пайда болды.","distractorIds":["fs9","fs11","fs14"]},{"id":"fs11","date":"ІХ-Х ғасырларда","event":"Шығыс славяндар Ладогадан Солтүстік Днепр жағасына дейінгі және Неман мен Припять беткейінен Ока және Волга өзендері аралығына дейінгі аумақты мекендеді.","distractorIds":["fs10","fs12","fs15"]},{"id":"fs12","date":"ІХ-ХІ ғасырларда","event":"1. Батыс Еуропаның көптеген елдерінде феодалдық қатынастардың қалыптасу үдерісі аяқталды.\n2. Еуропада жаңа мемлекеттер құрылды.","distractorIds":["fs11","fs13","fs16"]},{"id":"fs13","date":"Х ғасырда","event":"1. Еуропада, Италияда және Францияда феодалдық құрылым негізінен аяқталды.\n2. Лан қаласы Француз корольдігінің тұрақты астанасы болды.\n3. Батыс славян тайпалары мен князьдықтардан Польша мемлекеті қалыптасты.","distractorIds":["fs12","fs14","fs17"]},{"id":"fs14","date":"Х ғасырдың аяғында","event":"1. Англия мен Византияда феодалдық құрылым аяқталды.\n2. Француз корольдігінің астанасы Парижде тұрақтап тұрды.","distractorIds":["fs13","fs15","fs18"]},{"id":"fs15","date":"Х-ХІ ғасырларда","event":"1. Еуропада бытыраңқылық кең тарады.\n2. Әскердің негізгі түрі атты әскер болды.","distractorIds":["fs14","fs16","fs18"]},{"id":"fs16","date":"ХІ ғасырдың басынан","event":"Еуропада замоктар тастан қаланып салына бастады.","distractorIds":["fs15","fs17","fs12"]},{"id":"fs17","date":"ХІІ ғасырдың басында","event":"Германияда феодалдану үдерісі аяқталды.","distractorIds":["fs16","fs18","fs13"]},{"id":"fs18","date":"ХІІ-ХІІІ ғасырларда","event":"1. Рыцарь сауыттары пайда болды.\n2. Скандинавия елдерінде ерте феодалдық кезең қалыптасты.","distractorIds":["fs17","fs15","fs14"]}],"people":[{"id":"lombards","name":"Лангобардтар","clues":["VI ғасырдың соңында Италия аумағының басым бөлігін жаулап алды.","Аумақты герцогтіктерге бөлді.","Павия қаласын астана жасады."]},{"id":"normans","name":"Нормандар","clues":["Қазіргі норвегтердің, шведтердің, даниялықтардың арғы аталары.","Солтүстік және Балтық теңіздерінде балық аулап, күн көретін теңізшілер болды.","Шағын, берік, жылдам жүзетін кемелер жасады.","ІХ ғасырда Солтүстік Германияны, Францияны, Англияны тонап отырды.","Жұлдыздар арқылы өз жолын таба алатын еді."]},{"id":"goths-vandals-alans-suebi","name":"Вестготтар, вандалдар, аландар, свевтер","clues":["Испания аумағында қоныстанды."]},{"id":"arabs-spain","name":"Арабтар","clues":["709 жылы Вестгот корольдігінің аумағына келіп түсті.","711 жылы Испанияны жаулап алуды бастады."]},{"id":"spanish-christians","name":"Испандық-христиандар","clues":["Пиреней түбегінің солтүстігіндегі таулы аймақтарда арабтарға қарсылық көрсетті.","Сол жерде өз мемлекеттерінің негізін қалады."]},{"id":"eastern-slavs","name":"Шығыс славяндар","clues":["Ладогадан Солтүстік Днепрге, Неман мен Припятьтен Ока мен Волгаға дейінгі жерді мекендеді.","ІХ ғасырда орыс мемлекетін құрды."]},{"id":"western-slavs","name":"Батыс славян тайпалары","clues":["Одра, Варта, Висла және Балтық теңізі жағалауындағы тайпалық князьдықтардан тұрды.","Х ғасырда Польша мемлекетін қалыптастырды."]}],"chronologySets":[["fs4","fs5","fs7","fs8"],["fs9","fs10","fs13","fs17"],["fs3","fs8","fs14","fs18"],["fs10","fs13","fs16","fs17"]]}